{
  "schemaVersion": 1,
  "tool": { "name": "harness-medic", "version": "0.1.0" },
  "scan": { "id": "scan:example", "startedAt": "2026-01-01T00:00:00.000Z", "durationMs": 0, "tier": 0 },
  "workspace": "<fixture-workspace>",
  "privacy": {
    "redacted": true,
    "valuesSerialized": false,
    "networkRequests": 0,
    "childProcesses": 0,
    "notes": ["Sanitized static example; no configured command or network transport was executed."]
  },
  "coverage": [{
    "harness": "claude-code",
    "detected": false,
    "parsed": false,
    "precedenceModeled": true,
    "runtimeProbed": false,
    "behaviorObserved": false,
    "gaps": []
  }],
  "environments": [{
    "harness": "claude-code",
    "adapterVersion": "claude-code-adapter/0.1",
    "workspace": "<fixture-workspace>",
    "detected": false,
    "sources": [],
    "activeSourceIds": [],
    "shadowEdges": [],
    "coverageGaps": [],
    "instructions": [],
    "mcpServers": [],
    "tools": [],
    "hooks": [],
    "subagents": [],
    "permissions": [],
    "unknownFields": {}
  }],
  "observations": [],
  "findings": [],
  "summary": {
    "bySeverity": { "critical": 0, "error": 0, "warning": 0, "info": 0 },
    "byDoctor": {},
    "applicable": 0,
    "observed": 0,
    "unscored": 0,
    "healthIndex": 100,
    "deductions": []
  },
  "fixPlans": [],
  "internalDiagnostics": []
}
